ID,Title,Link,Author,Summary,Newspaper,PublishDate,NewspaperLink,ImageTitle,ImageURL,UpdateDate,Categories,GUID,AddedDate
6047441,"White House mocks Tim Walz after he tells Minnesotans to keep filming ICE agents in glitchy prime-time address: ‘Just resign’",https://nypost.com/2026/01/14/us-news/white-house-mocks-tim-walz-after-he-tells-minnesotans-to-keep-filming-ice-agents-in-glitchy-prime-time-address-just-resign/,"Victor Nava","The audio glitched just seconds into the video, with delayed sound of Walz’s remarks about the ongoing presence of federal law enforcement in the North Star State playing over the live sound.","New York Post","2026-01-14 19:56:47",https://nypost.com/,NULL,NULL,"2026-01-14 19:56:47",,https://nypost.com/?post_type=article&p=38187568,"2026-01-14 21:33:53"
6047442,"Tish Cyrus admits to ‘self-medicating’ with weed after ‘tragic’ Billy Ray divorce",https://pagesix.com/2026/01/14/celebrity-news/tish-cyrus-self-medicated-with-weed-after-billy-ray-divorce/,"BreAnna Bell","Tish filed for divorce from her husband of 29 years, Billy Ray, in April 2022.","New York Post","2026-01-14 19:55:31",https://nypost.com/,NULL,NULL,"2026-01-14 19:55:31",,https://pagesix.com/?post_type=article&p=8696784,"2026-01-14 21:33:53"
6047443,"Tish Cyrus admits to ‘self-medicating’ with weed after ‘tragic’ Billy Ray divorce",https://pagesix.com/2026/01/14/celebrity-news/tish-cyrus-self-medicated-with-weed-after-billy-ray-divorce/,mliss1578,"Tish filed for divorce from her husband of 29 years, Billy Ray, in April 2022.","New York Post","2026-01-14 19:55:31",https://nypost.com/,NULL,https://nypost.com/wp-content%2Fuploads%2Fsites%2F2%2F2026%2F01%2F118929401.jpg?quality%3D90%26,"2026-01-14 19:55:31",,https://pagesix.com/2026/01/14/celebrity-news/tish-cyrus-self-medicated-with-weed-after-billy-ray-divorce/,"2026-01-14 21:33:53"
6047444,"British Columbia ends 3-year drug decriminalization pilot project",https://nypost.com/2026/01/14/world-news/british-columbia-ends-3-year-drug-decriminalization-pilot-project/,"Associated Press","British Columbia has ended their project in decriminalizing possession of small amounts of drugs after 3 years.","New York Post","2026-01-14 19:42:05",https://nypost.com/,NULL,NULL,"2026-01-14 19:42:05",,https://nypost.com/?post_type=article&p=38187394,"2026-01-14 21:33:53"
6047445,"Two ‘foremost teams’ emerge in Anthony Davis trade sweepstakes",https://nypost.com/2026/01/14/sports/two-foremost-teams-emerge-in-anthony-davis-trade-sweepstakes/,"Christian Arnold","Davis, 32, is dealing with ligament damage in his left hand, but he got some good news on Tuesday that he wouldn’t have to undergo any surgery.","New York Post","2026-01-14 19:44:16",https://nypost.com/,NULL,NULL,"2026-01-14 19:44:16",,https://nypost.com/?post_type=article&p=38187340,"2026-01-14 21:33:53"
6047446,"Iranian mom who lost eye to bullet in 2021 hijab protest now lives in Calif. — and has desperate plea for Trump",https://nypost.com/2026/01/14/us-news/iranian-activist-mersedeh-shahinkar-pleads-for-trump-to-strike-iran-targets/,"Bianca Heyward",""I still say it was worth giving my eye for the freedom of my country."","New York Post","2026-01-14 19:41:07",https://nypost.com/,NULL,https://nypost.com/wp-content%2Fuploads%2Fsites%2F2%2F2026%2F01%2FMersedeh-Shahinkar.jpg?quality%3D90%26,"2026-01-14 19:41:07",,https://nypost.com/?post_type=article&p=38187040,"2026-01-14 21:33:53"
6047447,"Why is Stephen A Smith blaming Renee Good for her own death? | Etan Thomas",https://www.theguardian.com/sport/2026/jan/14/stephen-a-smith-renee-good-minnesota-shooting,"Etan Thomas"," The ESPN broadcaster’s comments about the ICE shooting in Minnesota moves him closer to the stance of another media figure he has long attacked  This past weekend there were  hundreds of demonstrations  across the United States after  Renee Good , an American citizen and mother of three,  was shot dead  by Jonathan Ross, an Immigration and Customs Enforcement (ICE) officer, in Minnesota.  The...","The Guardian","2026-01-14 04:00:23",https://www.theguardian.com/us,NULL,NULL,"2026-01-14 04:00:23","US sports,Sport,Minnesota ICE shooting,ESPN,NBA,ICE (US Immigration and Customs Enforcement)",https://www.theguardian.com/sport/2026/jan/14/stephen-a-smith-renee-good-minnesota-shooting,"2026-01-14 21:33:53"
6047448,"The Trump dynasty could run and run – but will Ivanka, Barron or Kai take the crown? | Arwa Mahdawi",https://www.theguardian.com/commentisfree/2026/jan/14/trump-dynasty-will-ivanka-barron-or-kai-take-the-crown,"Arwa Mahdawi"," This week, Trump’s granddaughter announced she definitely doesn’t want to go into politics. Expect a run for office very soon  Last week Kai Trump, Donald Trump Jr’s daughter and the president’s eldest grandchild, publicly declared she had no plans to run for office. The 18-year-old appeared on  Logan Paul’s Impaulsive       podcast , where she stated that “politics is such a dangerous thing ...","The Guardian","2026-01-14 04:00:22",https://www.theguardian.com/us,NULL,NULL,"2026-01-14 04:00:22","Donald Trump,Donald Trump Jr,Ivanka Trump,Jared Kushner,US politics,US news",https://www.theguardian.com/commentisfree/2026/jan/14/trump-dynasty-will-ivanka-barron-or-kai-take-the-crown,"2026-01-14 21:33:53"
6047449,"Two-time Pro Bowl receiver Adam Thielen retires from NFL after 12 seasons",https://nypost.com/2026/01/14/sports/receiver-adam-thielen-retires-from-nfl-after-12-seasons/,"Joseph Staszewski","One of the most productive receivers of this era is calling it a career.","New York Post","2026-01-14 19:37:55",https://nypost.com/,NULL,NULL,"2026-01-14 19:37:55",,https://nypost.com/?post_type=article&p=38187469,"2026-01-14 21:33:53"
6047450,"Recalled Super Greens diet supplement powder sickens 45 with salmonella",https://nypost.com/2026/01/14/health/recalled-super-greens-diet-supplement-powder-sickens-45-with-salmonella/,"Associated Press","Over 45 people across approximately two dozen states were struck with salmonella tied to the Live it Up-brand Super Greens powder.","New York Post","2026-01-14 19:39:19",https://nypost.com/,NULL,NULL,"2026-01-14 19:39:19",,https://nypost.com/?post_type=article&p=38187375,"2026-01-14 21:33:53"
6047451,"Ex-NY Lt. Gov. Betsy McCaughey running for governor in Connecticut",https://nypost.com/2026/01/14/us-news/ex-ny-lt-gov-betsy-mccaughey-running-for-governor-in-connecticut/,"Carl Campanile","Former New York Lt. Gov. Betsy McCaughey is kicking off her campaign Thursday for governor of Connecticut.","New York Post","2026-01-14 19:35:43",https://nypost.com/,NULL,NULL,"2026-01-14 19:35:43",,https://nypost.com/?post_type=article&p=38186716,"2026-01-14 21:33:53"
6047452,"The Giants have a major ace in the hole in their John Harbaugh pursuit",https://nypost.com/2026/01/14/sports/jaxson-dart-a-giants-ace-in-the-hole-in-john-harbaugh-pursuit/,"Paul Schwartz","Is there a QB I can work with and win with? John Harbaugh has been contemplating that for many days as he considers which NFL outpost to next inhabit.","New York Post","2026-01-14 19:30:03",https://nypost.com/,NULL,https://nypost.com/wp-content%2Fuploads%2Fsites%2F2%2F2026%2F01%2Fnewspress-collage-zk6wcyrhr-1768442107519.jpg?quality%3D90%26,"2026-01-14 19:30:03",,https://nypost.com/?post_type=article&p=38187326,"2026-01-14 21:33:53"
6047453,"Jonathan Quick gets pulled for second time in three games in latest Rangers disaster",https://nypost.com/2026/01/14/sports/jonathan-quick-gets-pulled-again-in-latest-rangers-disaster/,"Andrew Crane","Jonathan Quick’s 800th career start quickly turned into a disaster.","New York Post","2026-01-14 19:28:04",https://nypost.com/,NULL,NULL,"2026-01-14 19:28:04",,https://nypost.com/?post_type=article&p=38187577,"2026-01-14 21:33:53"
6047454,"Demonstrator injured after federal agent fired projectile from close range during California protest",https://www.broomfieldenterprise.com/2026/01/14/california-protester-blinded/,"Associated Press","  By AMY TAXIN  
 SANTA ANA, Calif. (AP) — A demonstrator was hit in the face with a projectile fired by a federal officer at close range during a Southern California protest, leaving him bloodied and with serious injuries, according to video and accounts from fellow protesters and family on Tuesday. 
 The Friday gathering outside the federal immigration building in the city of Santa Ana was i...","Broomfield Enterprise","2026-01-14 18:09:10",https://www.broomfieldenterprise.com/,NULL,NULL,"2026-01-14 18:09:10","National Politics,News,Politics,Immigration,Network",https://www.broomfieldenterprise.com/?p=558690&preview=true&preview_id=558690,"2026-01-14 21:33:53"
6047455,"Holy Family-Silver Creek boys basketball is BoCoPreps Game of the Week",https://www.broomfieldenterprise.com/2026/01/14/holy-family-silver-creek-hoops-game-week/,"Brent New"," Holy Family is continuing to run roughshod over the early portion of its boys basketball schedule. The latest episode: An 18-point win against Erie on Tuesday. 
 On Friday night at 7 p.m., the Tigers (9-0, 2-0 Granite Peaks League) are on the road at Silver Creek (9-1, 2-1), which had its perfect 9-0 start end in a 64-52 loss to Horizon on Tuesday. 
 Entering the week, Caleb Schott scored dou...","Broomfield Enterprise","2026-01-14 18:19:33",https://www.broomfieldenterprise.com/,NULL,NULL,"2026-01-14 18:19:33","High School Sports,Latest Headlines,News,Sports,Holy Family Tigers",https://www.broomfieldenterprise.com/?p=558702&preview=true&preview_id=558702,"2026-01-14 21:33:53"
6047456,"Free Starlink access for Iran seen as game changer for demonstrators getting their message out",https://www.broomfieldenterprise.com/2026/01/14/iran-protests-starlink/,"Associated Press","  By DAVID RISING  
 BANGKOK (AP) — Iranian demonstrators’ ability to get details of  bloody nationwide protests  out to the world has been given a strong boost, with SpaceX’s Starlink satellite internet service dropping its fees to allow more people to circumvent the Tehran government’s strongest attempt ever to prevent information from spilling outside its borders, activists said Wednesday. ...","Broomfield Enterprise","2026-01-14 17:47:23",https://www.broomfieldenterprise.com/,NULL,NULL,"2026-01-14 17:47:23","News,World News,Network",https://www.broomfieldenterprise.com/?p=558670&preview=true&preview_id=558670,"2026-01-14 21:33:53"
6047457,"Public mistrust linked to drop in deceased donor organ donations and kidney transplants",https://www.broomfieldenterprise.com/2026/01/14/kidney-transplants-down/,"Associated Press","  By LAURAN NEERGAARD  
 WASHINGTON (AP) — Organ donations from the recently deceased dropped last year for the first time in over a decade, resulting in fewer kidney transplants, according to an analysis issued Wednesday that pointed to signs of  public mistrust  in the lifesaving system. 
  Related Articles   
			 
	
				 
			Trump administration slashes funding for substance abuse and menta...","Broomfield Enterprise","2026-01-14 17:36:45",https://www.broomfieldenterprise.com/,NULL,NULL,"2026-01-14 17:36:45","Health,National News,News,Network",https://www.broomfieldenterprise.com/?p=558660&preview=true&preview_id=558660,"2026-01-14 21:33:53"
6047458,"California’s scenic Highway 1 near Big Sur reopens 3 years after damaging landslides",https://www.broomfieldenterprise.com/2026/01/14/california-highway-reopens/,"Associated Press"," BIG SUR, Calif. (AP) — A 90-mile section of California’s Highway 1 along the famous Big Sur coast fully reopened Wednesday after three years of closures and repairs following a series of landslides and a roadway collapse that hampered tourism on the scenic route. 
  Related Articles   
			 
	
				 
			Public mistrust linked to drop in deceased donor organ donations and kidney transplants		 

...","Broomfield Enterprise","2026-01-14 17:31:29",https://www.broomfieldenterprise.com/,NULL,NULL,"2026-01-14 17:31:29","National News,News,Network",https://www.broomfieldenterprise.com/?p=558657&preview=true&preview_id=558657,"2026-01-14 21:33:53"
6047459,"A man shot by Border Patrol during an Oregon immigration stop pleads not guilty to assault on agent",https://www.broomfieldenterprise.com/2026/01/14/immigration-enforcement-oregon-shooting-plea-entered/,"Associated Press","  By CLAIRE RUSH  
 PORTLAND, Ore. (AP) — A man  shot and wounded  by a Border Patrol agent during an immigration stop in Portland, Oregon, last week pleaded not guilty Wednesday to aggravated assault on a federal employee and damaging federal property. 
  Related Articles   
			 
	
				 
			Demonstrator injured after federal agent fired projectile from close range during California protest		 ...","Broomfield Enterprise","2026-01-14 17:17:48",https://www.broomfieldenterprise.com/,NULL,NULL,"2026-01-14 17:17:48","National Politics,News,Politics,Immigration,Network",https://www.broomfieldenterprise.com/?p=558651&preview=true&preview_id=558651,"2026-01-14 21:33:53"
6047460,"New DHS rule aims to shorten visa wait times abroad for religious workers serving US congregations",https://www.broomfieldenterprise.com/2026/01/14/religious-workers-visa/,"Associated Press","  By TIFFANY STANLEY and GIOVANNA DELL’ORTO  
 WASHINGTON (AP) — At a time of tightening  immigration  restrictions, the Department of Homeland Security is attempting to make it easier for visa-holding  religious workers  to serve their U.S. congregations with less disruption. 
  Related Articles   
			 
	
				 
			Demonstrator injured after federal agent fired projectile from close range duri...","Broomfield Enterprise","2026-01-14 16:57:54",https://www.broomfieldenterprise.com/,NULL,NULL,"2026-01-14 16:57:54","National Politics,News,Politics,Network",https://www.broomfieldenterprise.com/?p=558646&preview=true&preview_id=558646,"2026-01-14 21:33:53"
6047461,"Renaming the Department of Defense the ‘Department of War’ could cost up to $125 million",https://www.broomfieldenterprise.com/2026/01/14/pentagon-renaming/,"Associated Press","  By FATIMA HUSSEIN and KONSTANTIN TOROPIN  
 WASHINGTON (AP) — Renaming the Department of Defense the  Department of War  could cost U.S. taxpayers as much as $125 million depending on how broadly and quickly the change is made, according to an analysis released Wednesday from the Congressional Budget Office. 
  Related Articles   
			 
	
				 
			Demonstrator injured after federal agent fire...","Broomfield Enterprise","2026-01-14 16:25:54",https://www.broomfieldenterprise.com/,NULL,NULL,"2026-01-14 16:25:54","National Politics,News,Politics,Network",https://www.broomfieldenterprise.com/?p=558628&preview=true&preview_id=558628,"2026-01-14 21:33:53"
6047462,"Front Range preps events to watch this weekend",https://www.broomfieldenterprise.com/2026/01/14/events-to-watch-this-weekend/,"Brent New"," The boys basketball teams from Fairview and Boulder find themselves heading in different directions as they meet up for their annual rivalry on the hardwood Thursday night. 
 The Knights (7-4) lost four of five heading into last weekend before turning things around with three wins in five days. On Tuesday, senior Jake Genschaw exploded for a career-high 21 points on 9-for-10 shooting in a 63-...","Broomfield Enterprise","2026-01-14 17:22:37",https://www.broomfieldenterprise.com/,NULL,NULL,"2026-01-14 17:22:37","High School Sports,Latest Headlines,News,Sports,Broomfield Eagles,Legacy Lightning",https://www.broomfieldenterprise.com/?p=558654&preview=true&preview_id=558654,"2026-01-14 21:33:53"
6047463,"Recalled ‘Super Greens’ diet supplement powder sickens 45 with salmonella",https://www.broomfieldenterprise.com/2026/01/14/salmonella-super-greens/,"Associated Press","  By JONEL ALECCIA  
 At least 45 people in nearly two dozen states have been sickened with salmonella food poisoning tied to a brand of “super greens” diet supplement powder, federal health officials said Wednesday. 
  Related Articles   
			 
	
				 
			Public mistrust linked to drop in deceased donor organ donations and kidney transplants		 



			 
	
	
  
			 
	
				 
			California’s sceni...","Broomfield Enterprise","2026-01-14 16:37:47",https://www.broomfieldenterprise.com/,NULL,NULL,"2026-01-14 16:37:47","National News,News,Network",https://www.broomfieldenterprise.com/?p=558641&preview=true&preview_id=558641,"2026-01-14 21:33:53"
6047464,"Desiree Wooten scores 24 as Colorado women beat No. 19 Iowa State 68-62",https://www.denverpost.com/2026/01/14/desiree-wooten-scores-24-as-colorado-women-beat-no-19-iowa-state-68-62/,"The Associated Press"," BOULDER, Colo. (AP) &#8212; Desiree Wooten scored a season-high 24 points, and Jade Masogayo added 15 as Colorado held off No. 19 Iowa State 68-62 on Wednesday night. 
 Zyanna Walker added 10 for the Buffaloes (11-6, 3-3 Big 12). Anaelle Dutat had 12 rebounds to go with nine points. It was the first time Colorado has beaten Iowa State since rejoining the Big 12. 
 Colorado took it first lead ...","Denver Post","2026-01-14 21:24:45",https://www.denverpost.com/,NULL,NULL,"2026-01-14 21:24:45","College Sports,Latest Headlines,Sports",https://www.denverpost.com/?p=7394483&preview=true&preview_id=7394483,"2026-01-14 21:33:53"
6047465,"CU Buffs women’s basketball upsets No. 19 Iowa State",https://www.denverpost.com/2026/01/14/colorado-buffs-vs-iowa-state-womens-basketball/,"Brian Howell"," Desiree Wooten scored a season-high 24 points, Tabitha Betson hit a pair of giant 3-pointers late in the fourth quarter and the Colorado women’s basketball team upset No. 19 Iowa State 68-62 on Wednesday night at the CU Events Center. 
 This is the sixth consecutive season the Buffaloes have defeated at least one Associated Press Top 25 opponent. 

 In front of a season-best crowd of 4,183 at...","Denver Post","2026-01-14 21:06:00",https://www.denverpost.com/,NULL,NULL,"2026-01-14 21:06:00","Latest Headlines,News,Sports",https://www.denverpost.com/?p=7394475&preview=true&preview_id=7394475,"2026-01-14 21:33:53"
6047466,"Another comeback falls short for Colorado basketball at Cincinnati",https://www.denverpost.com/2026/01/14/colorado-buffaloes-basketball-vs-cincinnati-bearcats/,"Pat Rooney"," Fast break 
 Why the Buffs lost: CU finished with 17 turnovers, the second-highest total of the season, and allowed the team with the lowest field goal percentage in the Big 12 to shoot .571 in the first half. 
  Three stars  
 1. UC’s Baba Miller. Put up a double-double against the Buffs, finishing with 25 points and 11 rebounds. 
 2. UC’s Moustapha Thiam. The other half of an inside tandem ...","Denver Post","2026-01-14 19:31:49",https://www.denverpost.com/,NULL,NULL,"2026-01-14 19:31:49","Latest Headlines,News,Sports,college basketball",https://www.denverpost.com/?p=7394435&preview=true&preview_id=7394435,"2026-01-14 21:33:53"
6047467,"‘Patient’ Vance Joseph all in on Broncos, says head coaching jobs ‘on back burner’",https://www.denverpost.com/2026/01/14/broncos-vance-joseph-defense-coaching/,"Patrick Saunders"," If Vance Joseph&#8217;s head is spinning, it&#8217;s not because he&#8217;s one of the NFL&#8217;s hottest head coaching candidates. Nope. It&#8217;s because he has quarterback Josh Allen and the Buffalo Bills crowding his brain.
 The job stuff? 
 &#8220;It&#8217;s been on the back burner,&#8221; Joseph said on Wednesday. &#8220;For me, winning is a priority. What happens after that happens. ...","Denver Post","2026-01-14 18:21:25",https://www.denverpost.com/,NULL,NULL,"2026-01-14 18:21:25","Denver Broncos,Latest Headlines,NFL,Sports,broncos,Empower Field at Mile High,Gary Kubiak,Josh Allen,Justin Strnad,More Broncos News,Super Bowl,Vance Joseph",https://www.denverpost.com/?p=7394012,"2026-01-14 21:33:53"
6047468,"Colorado Rapids announce 2026 preseason roster, staff under new head coach Matt Wells",https://www.denverpost.com/2026/01/14/colorado-rapids-2026-preseason-roster-coaches/,"Braidon Nourse"," The Colorado Rapids announced the preseason roster and full coaching and technical staff on Tuesday as the club reported for preseason in Florida, offering the first clear picture of what new head coach Matt Wells will work with in year one of his first-ever head coaching role. The roster has a healthy mix of new signings and Rapids 2 standouts to pair with returning first-team players. 
 Wel...","Denver Post","2026-01-14 17:58:28",https://www.denverpost.com/,NULL,NULL,"2026-01-14 17:58:28","Colorado Rapids,Latest Headlines,Soccer,Sports,soccer",https://www.denverpost.com/?p=7393009,"2026-01-14 21:33:53"
6047469,"Colorado Democrats aim to allow for ICE lawsuits, seek oversight of immigration detention centers",https://www.denverpost.com/2026/01/14/colorado-democrats-immigration-bills-legislation/,"Seth Klamann"," Twelve months into President Donald Trump&#8217;s mass-deportation program, Democratic lawmakers in Colorado are preparing a three-pronged package of bills aimed at regulating immigration enforcement and the detention facilities where authorities hold immigrants &#8212; and further tightening a law that  Gov. Jared Polis tried to sidestep last summer . 
 The first bill in the package,  Senate...","Denver Post","2026-01-14 17:51:39",https://www.denverpost.com/,NULL,NULL,"2026-01-14 17:51:39","Colorado News,Latest Headlines,News,Politics,airports,bipartisan,carbon,child,children,climate,coal,college,Colorado Legislature,court,courts,Democrat,Democrats,Denver,deportation,discrimination,Donald Trump,electric,electricity,emissions,Evergreen High School,Evergreen High School shooting,family,FBI,food,gender,good,gov,hospitals,housing,ice,immigration,Immigration and Customs Enforcement,Jared Polis,labor,law enforcement,lawsuit,lawsuits,Lorena Garcia,media,Mesa County Sheriff,Mike Weissman,Minnesota,nation,nonprofits,one,People,president,regulations,Renee Good,Rep,rural,school,Senate,shooting,social media,spring,summer,Tom Sullivan,transgender,transit,Trump,union,Utah,world",https://www.denverpost.com/?p=7393977,"2026-01-14 21:33:53"
6047470,"Renck: Broncos need to run Jaleel McLaughlin to stop critics from running their mouths",https://www.denverpost.com/2026/01/14/broncos-run-game-buffalo-bills-jaleel-mclaughlin-bo-nix-renck/,"Troy Renck"," Three weeks. That is all it  took for the country to turn on the Broncos again . They are corn to a garden. The worst seed ever. 
 Failing to score more than  20 points in three straight games  to end the season was all America&#8217;s armchair quarterbacks and well-paid analysts needed.
 The offensive impotence is catnip for critics. 
 So, it is no wonder that the AFC&#8217;s top dog is an u...","Denver Post","2026-01-14 16:49:28",https://www.denverpost.com/,NULL,NULL,"2026-01-14 16:49:28","Denver Broncos,Kansas City Chiefs,Latest Headlines,Los Angeles Chargers,NFL,Sports,Sports Columnists,Bo Nix,broncos,Gary Kubiak,J.K. Dobbins,Jaleel McLaughlin,Josh Allen,Mike McGlinchey,More Broncos News,NFL playoffs,Peyton Manning,R.J. Harvey,Sean Payton,Super Bowl 50,Troy Renck,Tyler Badie",https://www.denverpost.com/?p=7393800,"2026-01-14 21:33:53"
6047471,"Public mistrust linked to drop in deceased donor organ donations and kidney transplants",https://www.denverpost.com/2026/01/14/kidney-transplants-down/,"The Associated Press","  By LAURAN NEERGAARD  
 WASHINGTON (AP) — Organ donations from the recently deceased dropped last year for the first time in over a decade, resulting in fewer kidney transplants, according to an analysis issued Wednesday that pointed to signs of  public mistrust  in the lifesaving system. 
  Related Articles   
			 
	
				 
			Trump administration slashes funding for substance abuse and menta...","Denver Post","2026-01-14 17:36:45",https://www.denverpost.com/,NULL,NULL,"2026-01-14 17:36:45","Health,National News,News,health,nation,network",https://www.denverpost.com/?p=7394341&preview=true&preview_id=7394341,"2026-01-14 21:33:53"
6047472,"Broncos OL Alex Palczewski ‘shocked’ at receiving an All-Pro vote: ‘Pretty (expletive) cool’",https://www.denverpost.com/2026/01/14/broncos-alex-palczewski-all-pro-vote/,"Luca Evans"," A few days ago, reserve offensive lineman Alex Palczewski walked into the Broncos&#8217; locker room and received a healthy dose of &#8220;crap&#8221; &#8212; as he put it &#8212; from quarterback Bo Nix. 
 &#8220;What&#8217;s up, All-Pro Palcho?&#8221; Nix cracked, as Palczewski recalled. 
 &#8220;What are you talking about?&#8221; Palczewski asked, confused. 
 &#8220;Ah,&#8221; Nix replied,...","Denver Post","2026-01-14 16:35:27",https://www.denverpost.com/,NULL,NULL,"2026-01-14 16:35:27","Denver Broncos,Latest Headlines,NFL,Sports,Alex Palczewski,Ben Powers,Bo Nix,J.K. Dobbins,Matt Peart,More Broncos News,Sean Payton,Zach Strief",https://www.denverpost.com/?p=7394067,"2026-01-14 21:33:53"
6047473,"Renaming the Department of Defense the ‘Department of War’ could cost up to $125 million",https://www.denverpost.com/2026/01/14/pentagon-renaming/,"The Associated Press","  By FATIMA HUSSEIN and KONSTANTIN TOROPIN  
 WASHINGTON (AP) — Renaming the Department of Defense the  Department of War  could cost U.S. taxpayers as much as $125 million depending on how broadly and quickly the change is made, according to an analysis released Wednesday from the Congressional Budget Office. 
  Related Articles   
			 
	
				 
			Hundreds of laid-off researchers at US workpl...","Denver Post","2026-01-14 16:25:54",https://www.denverpost.com/,NULL,NULL,"2026-01-14 16:25:54","National Politics,News,Politics,Donald Trump,network",https://www.denverpost.com/?p=7394218&preview=true&preview_id=7394218,"2026-01-14 21:33:53"
