ID,Title,Link,Author,Summary,Newspaper,PublishDate,NewspaperLink,ImageTitle,ImageURL,UpdateDate,Categories,GUID,AddedDate
6046258,"Drug dealer jailed for just 15 months after supplying ecstasy that killed his girlfriend, 16",https://www.dailymail.co.uk/news/article-15461077/Drug-dealer-jailed-just-15-months-supplying-ecstasy-killed-girlfriend-16.html?ns_mchannel=rss&ns_campaign=1490&ito=1490,Editor,"A drug dealer who supplied the ecstasy which killed his 16-year-old girlfriend has been sent to prison for 15 months.","The Daily Mail","2026-01-13 14:46:05",http://www.dailymail.co.uk/ushome/index.html,NULL,https://i.dailymail.co.uk/1s/2026/01/13/21/105486233-0-image-m-15_1768338446438.jpg,"2026-01-13 14:46:05",,https://www.dailymail.co.uk/news/article-15461077/Drug-dealer-jailed-just-15-months-supplying-ecstasy-killed-girlfriend-16.html?ns_mchannel=rss&ns_campaign=1490&ito=1490,"2026-01-13 16:51:12"
6046259,"Now SNP hits homeowners with 'mansion tax' on properties worth at least £1million",https://www.dailymail.co.uk/news/article-15460901/Now-SNP-hits-homeowners-mansion-tax-properties-worth-1million.html?ns_mchannel=rss&ns_campaign=1490&ito=1490,Editor,"Finance Secretary Shona Robison used her Budget statement to create two new council tax bands from April 2028, which will raise around £16million a year.","The Daily Mail","2026-01-13 14:45:14",http://www.dailymail.co.uk/ushome/index.html,NULL,https://i.dailymail.co.uk/1s/2026/01/13/20/105485349-0-image-a-4_1768336101597.jpg,"2026-01-13 14:45:14",,https://www.dailymail.co.uk/news/article-15460901/Now-SNP-hits-homeowners-mansion-tax-properties-worth-1million.html?ns_mchannel=rss&ns_campaign=1490&ito=1490,"2026-01-13 16:51:12"
6046260,"ICE shooting victim Renee Nicole Good's family breaks silence on claims she had a criminal past",https://www.dailymail.co.uk/news/article-15460771/renee-nicole-good-family-break-silence-ice-agent-shooting.html?ns_mchannel=rss&ns_campaign=1490&ito=1490,Editor,"The family of Renee Nicole Good, the woman fatally shot last week during an anti-ICE protest in Minnesota, have broken their silence over claims the 37-year-old had a criminal past.","The Daily Mail","2026-01-13 14:34:55",http://www.dailymail.co.uk/ushome/index.html,NULL,https://i.dailymail.co.uk/1s/2026/01/13/19/105483273-0-image-m-48_1768333244630.jpg,"2026-01-13 14:34:55",,https://www.dailymail.co.uk/news/article-15460771/renee-nicole-good-family-break-silence-ice-agent-shooting.html?ns_mchannel=rss&ns_campaign=1490&ito=1490,"2026-01-13 16:51:12"
6046261,"Attorney General facing backlash over claims he lobbies Keir Starmer in the No 10 flat to water down policies that would curb human rights",https://www.dailymail.co.uk/news/article-15460477/Attorney-General-facing-backlash-claims-lobbies-Keir-Starmer-No-10-flat-water-policies-curb-human-rights.html?ns_mchannel=rss&ns_campaign=1490&ito=1490,Editor,"Ministers have voiced frustration that Lord Hermer is exploiting his close personal friendship with Keir Starmer to bypass normal Cabinet government.","The Daily Mail","2026-01-13 14:23:41",http://www.dailymail.co.uk/ushome/index.html,NULL,https://i.dailymail.co.uk/1s/2026/01/13/18/105481741-0-image-a-14_1768328910849.jpg,"2026-01-13 14:23:41",,https://www.dailymail.co.uk/news/article-15460477/Attorney-General-facing-backlash-claims-lobbies-Keir-Starmer-No-10-flat-water-policies-curb-human-rights.html?ns_mchannel=rss&ns_campaign=1490&ito=1490,"2026-01-13 16:51:12"
6046262,"RUSSELL FINDLAY: This skewed Budget from a failing SNP government was another two-fingered insult aimed at ordinary Scots voters",https://www.dailymail.co.uk/news/article-15460887/RUSSELL-FINDLAY-skewed-Budget-failing-SNP-government-two-fingered-insult-aimed-ordinary-Scots-voters.html?ns_mchannel=rss&ns_campaign=1490&ito=1490,Editor,"If hard-working Scots had any lingering doubts about how they were viewed by the SNPgovernment, yesterday dispelled them.","The Daily Mail","2026-01-13 14:21:33",http://www.dailymail.co.uk/ushome/index.html,NULL,https://i.dailymail.co.uk/1s/2026/01/13/20/105484951-0-image-m-24_1768335324646.jpg,"2026-01-13 14:21:33",,https://www.dailymail.co.uk/news/article-15460887/RUSSELL-FINDLAY-skewed-Budget-failing-SNP-government-two-fingered-insult-aimed-ordinary-Scots-voters.html?ns_mchannel=rss&ns_campaign=1490&ito=1490,"2026-01-13 16:51:12"
6046263,"STEPHEN DAISLEY: Austerity? The SNP state is so bloated it's in need of Ozempic",https://www.dailymail.co.uk/news/article-15460883/STEPHEN-DAISLEY-Austerity-SNP-state-bloated-need-Ozempic.html?ns_mchannel=rss&ns_campaign=1490&ito=1490,Editor,"Shona Robison's Budget was like that time OprahWinfrey bought every member of her studio audience a new set of wheels, with the US chat show queen hollering: 'You get a car! You get...","The Daily Mail","2026-01-13 14:20:52",http://www.dailymail.co.uk/ushome/index.html,NULL,https://i.dailymail.co.uk/1s/2026/01/13/20/105485999-0-image-a-54_1768337960303.jpg,"2026-01-13 14:20:52",,https://www.dailymail.co.uk/news/article-15460883/STEPHEN-DAISLEY-Austerity-SNP-state-bloated-need-Ozempic.html?ns_mchannel=rss&ns_campaign=1490&ito=1490,"2026-01-13 16:51:12"
6046264,"MICHAEL GLACKIN: SNP had a golden opportunity to help businesses hindered by Labour's dogmatic policies...but failed spectacularly",https://www.dailymail.co.uk/news/article-15460905/MICHAEL-GLACKIN-SNP-golden-opportunity-help-businesses-hindered-Labours-dogmatic-policies-failed-spectacularly.html?ns_mchannel=rss&ns_campaign=1490&ito=1490,Editor,"Waiting for a budgetfor growth from the SNPhas been the economic version of Waiting for Godot.","The Daily Mail","2026-01-13 14:18:26",http://www.dailymail.co.uk/ushome/index.html,NULL,https://i.dailymail.co.uk/1s/2026/01/13/20/105485359-0-image-m-40_1768336146905.jpg,"2026-01-13 14:18:26",,https://www.dailymail.co.uk/news/article-15460905/MICHAEL-GLACKIN-SNP-golden-opportunity-help-businesses-hindered-Labours-dogmatic-policies-failed-spectacularly.html?ns_mchannel=rss&ns_campaign=1490&ito=1490,"2026-01-13 16:51:12"
6046265,"Husband sobs as murder trial hears his 911 call after prosecutors say he killed wife and second man so he could be with nanny he was sleeping with",https://www.dailymail.co.uk/news/article-15460421/Brendan-Banfield-murder-trial-nanny-Virginia-911-call.html?ns_mchannel=rss&ns_campaign=1490&ito=1490,Editor,"The nearly nine-minute phone call brought Brendan Banfield to tears during the hearing at Fairfax County court on Tuesday.","The Daily Mail","2026-01-13 14:17:42",http://www.dailymail.co.uk/ushome/index.html,NULL,https://i.dailymail.co.uk/1s/2026/01/13/20/105483225-0-image-m-24_1768334493853.jpg,"2026-01-13 14:17:42",,https://www.dailymail.co.uk/news/article-15460421/Brendan-Banfield-murder-trial-nanny-Virginia-911-call.html?ns_mchannel=rss&ns_campaign=1490&ito=1490,"2026-01-13 16:51:12"
6046266,"EUAN McCOLM: A vote for the SNP was a vote for openness and transparency, they said. After 19 years in power, that vow's been dumped",https://www.dailymail.co.uk/news/article-15460903/EUAN-McCOLM-vote-SNP-vote-openness-transparency-said-19-years-power-vows-dumped.html?ns_mchannel=rss&ns_campaign=1490&ito=1490,Editor,"The SNP rose to power promising a new kind of politics driven by compassion and characterised by transparency.","The Daily Mail","2026-01-13 14:14:44",http://www.dailymail.co.uk/ushome/index.html,NULL,https://i.dailymail.co.uk/1s/2026/01/13/20/105484989-0-image-m-70_1768335694235.jpg,"2026-01-13 14:14:44",,https://www.dailymail.co.uk/news/article-15460903/EUAN-McCOLM-vote-SNP-vote-openness-transparency-said-19-years-power-vows-dumped.html?ns_mchannel=rss&ns_campaign=1490&ito=1490,"2026-01-13 16:51:12"
6046267,"TV's Jackie says she felt 'honoured' by MBE ceremony at Windsor Castle",https://www.dailymail.co.uk/news/article-15460909/TVs-Jackie-says-felt-honoured-MBE-ceremony-Windsor-Castle.html?ns_mchannel=rss&ns_campaign=1490&ito=1490,Editor,"Broadcasting veteran Jackie Bird said she was "honoured" to be decorated by the Princess Royalat Windsor Castleon Tuesday.","The Daily Mail","2026-01-13 14:13:42",http://www.dailymail.co.uk/ushome/index.html,NULL,https://i.dailymail.co.uk/1s/2026/01/13/19/105484485-0-image-m-44_1768334274074.jpg,"2026-01-13 14:13:42",,https://www.dailymail.co.uk/news/article-15460909/TVs-Jackie-says-felt-honoured-MBE-ceremony-Windsor-Castle.html?ns_mchannel=rss&ns_campaign=1490&ito=1490,"2026-01-13 16:51:12"
6046268,"GRAHAM GRANT: SNP budget was a missed opportunity to deliver Scots from tax hell",https://www.dailymail.co.uk/news/article-15460885/GRAHAM-GRANT-SNP-budget-missed-opportunity-deliver-Scots-tax-hell.html?ns_mchannel=rss&ns_campaign=1490&ito=1490,Editor,"It promised a 'more prosperous future' for Scotland - but Shona Robison's Budget was one of the biggest missed opportunities in Holyrood's history.","The Daily Mail","2026-01-13 14:12:43",http://www.dailymail.co.uk/ushome/index.html,NULL,https://i.dailymail.co.uk/1s/2026/01/13/19/105484307-0-image-a-25_1768333728078.jpg,"2026-01-13 14:12:43",,https://www.dailymail.co.uk/news/article-15460885/GRAHAM-GRANT-SNP-budget-missed-opportunity-deliver-Scots-tax-hell.html?ns_mchannel=rss&ns_campaign=1490&ito=1490,"2026-01-13 16:51:12"
6046269,"'Act like Elvis walked in': Trump confidant's splashy India debut hits a nerve in New Delhi",https://www.dailymail.co.uk/news/article-15460535/Trumps-ambassador-MAGAfied-rally-Elvis.html?ns_mchannel=rss&ns_campaign=1490&ito=1490,Editor,"Sergio Gor, a long-time loyalist of President Trump, brought a distinct touch of Mar-a-Lago to his Monday inauguration in New Delhi.","The Daily Mail","2026-01-13 14:04:35",http://www.dailymail.co.uk/ushome/index.html,NULL,https://i.dailymail.co.uk/1s/2026/01/13/20/105484667-0-image-a-7_1768336039302.jpg,"2026-01-13 14:04:35",,https://www.dailymail.co.uk/news/article-15460535/Trumps-ambassador-MAGAfied-rally-Elvis.html?ns_mchannel=rss&ns_campaign=1490&ito=1490,"2026-01-13 16:51:12"
6046270,"Teenage 'driver', 18, 'liked crazy speeds' and 'flipped his car' just weeks before he was killed in Bolton head-on crash",https://www.dailymail.co.uk/news/article-15460413/Teenage-driver-crazy-speeds-flipped-car-killed-Bolton-crash.html?ns_mchannel=rss&ns_campaign=1490&ito=1490,Editor,"Mohammed Jibrael Mukhtar, 18, also known as Jibril, was understood to have been driving his souped-up Seat Leon in Bolton, Greater Manchester, in the early hours of Sunday.","The Daily Mail","2026-01-13 13:52:28",http://www.dailymail.co.uk/ushome/index.html,NULL,https://i.dailymail.co.uk/1s/2026/01/13/19/105483643-0-image-m-28_1768333494929.jpg,"2026-01-13 13:52:28",,https://www.dailymail.co.uk/news/article-15460413/Teenage-driver-crazy-speeds-flipped-car-killed-Bolton-crash.html?ns_mchannel=rss&ns_campaign=1490&ito=1490,"2026-01-13 16:51:12"
6046271,"Child is killed in avalanche in Austria 'while skiing with another youngster'",https://www.dailymail.co.uk/news/article-15460957/Child-killed-avalanche-Austria-skiing-youngster.html?ns_mchannel=rss&ns_campaign=1490&ito=1490,Editor,"An avalanche killed a 13-year-old skiing off-piste in the Austrian alpine resort of Bad Gastein on Tuesday, in the country's second avalanche death since Sunday, rescuers said.","The Daily Mail","2026-01-13 13:51:25",http://www.dailymail.co.uk/ushome/index.html,NULL,https://i.dailymail.co.uk/1s/2026/01/13/20/105485307-0-image-a-5_1768335950886.jpg,"2026-01-13 13:51:25",,https://www.dailymail.co.uk/news/article-15460957/Child-killed-avalanche-Austria-skiing-youngster.html?ns_mchannel=rss&ns_campaign=1490&ito=1490,"2026-01-13 16:51:12"
6046272,"Society heiress reveals hedge funder husband's ice-cold move to prove he didn't want any custody of their children after dumping her for younger woman",https://www.dailymail.co.uk/news/article-15460201/belle-burden-husband-affair-custody-children-new-york.html?ns_mchannel=rss&ns_campaign=1490&ito=1490,Editor,"Society heiress Flobelle 'Belle' Fairbanks Burden, 56, has revealed more details about what has transpired since her shock split with her financier husband Henry Davis, 60, after 20 years of marriage.","The Daily Mail","2026-01-13 13:46:35",http://www.dailymail.co.uk/ushome/index.html,NULL,https://i.dailymail.co.uk/1s/2026/01/13/18/105446549-0-image-m-8_1768328889264.jpg,"2026-01-13 13:46:35",,https://www.dailymail.co.uk/news/article-15460201/belle-burden-husband-affair-custody-children-new-york.html?ns_mchannel=rss&ns_campaign=1490&ito=1490,"2026-01-13 16:51:12"
6046273,"Trump revives Joe Biden obsession with brutal imitation and wild new drug accusations during economic speech",https://www.dailymail.co.uk/news/article-15460807/trump-biden-cough-imitation-drug-economic-speech.html?ns_mchannel=rss&ns_campaign=1490&ito=1490,Editor,"President Donald Trump has revived his campaign persona, touting his policy victories while aiming, once again, at Joe Biden, who he claimed was propped up by drugs in his final days in office.","The Daily Mail","2026-01-13 13:44:12",http://www.dailymail.co.uk/ushome/index.html,NULL,https://i.dailymail.co.uk/1s/2026/01/13/20/105484507-0-image-a-62_1768334626105.jpg,"2026-01-13 13:44:12",,https://www.dailymail.co.uk/news/article-15460807/trump-biden-cough-imitation-drug-economic-speech.html?ns_mchannel=rss&ns_campaign=1490&ito=1490,"2026-01-13 16:51:12"
6046274,"Improbable rise, sudden fall and Trumpian reinvention of Dilbert creator Scott Adams, dead at 68: How a cartoon chronicler of office drudgery became a fearless anti-woke warrior",https://www.dailymail.co.uk/news/article-15460205/scott-adams-dilbert-prostate-cancer-trump.html?ns_mchannel=rss&ns_campaign=1490&ito=1490,Editor,"The scramble up the corporate career ladder gave birth to Dilbert - the beloved cartoon character, created by Adams in the late 1980s","The Daily Mail","2026-01-13 13:35:03",http://www.dailymail.co.uk/ushome/index.html,NULL,https://i.dailymail.co.uk/1s/2026/01/13/19/105482723-0-image-a-18_1768330848725.jpg,"2026-01-13 13:35:03",,https://www.dailymail.co.uk/news/article-15460205/scott-adams-dilbert-prostate-cancer-trump.html?ns_mchannel=rss&ns_campaign=1490&ito=1490,"2026-01-13 16:51:12"
6046275,"James Bulger's parents blast Jon Venables for putting them through 'unimaginable trauma' in his latest bid for freedom",https://www.dailymail.co.uk/news/article-15460051/james-bulger-parents-jon-venables-freedom-bid.html?ns_mchannel=rss&ns_campaign=1490&ito=1490,Editor,"Jon Venables and Robert Thompson were just 10-years-old when they were found guilty of abducting, torturing, and murdering two-year-old James Bulger in Merseyside in 1993.","The Daily Mail","2026-01-13 13:31:10",http://www.dailymail.co.uk/ushome/index.html,NULL,https://i.dailymail.co.uk/1s/2026/01/13/17/105479585-0-image-m-16_1768323962524.jpg,"2026-01-13 13:31:10",,https://www.dailymail.co.uk/news/article-15460051/james-bulger-parents-jon-venables-freedom-bid.html?ns_mchannel=rss&ns_campaign=1490&ito=1490,"2026-01-13 16:51:12"
6046276,"Teens 'sent man, 49, messages using fake girl's name before accusing him of being a paedophile and beating him to death with rocks' on the Isle of Sheppey, court hears",https://www.dailymail.co.uk/news/article-15460401/Teens-fake-messages-paedophile-death-rocks-Isle-Sheppey.html?ns_mchannel=rss&ns_campaign=1490&ito=1490,Editor,"A 16-year-old girl and two boys aged 15 and 16 are accused of meeting Alexander Cashford, 49, in Leysdown-on-Sea, on the Isle of Sheppey, in Kent, before 'beating him to death', last August.","The Daily Mail","2026-01-13 13:26:50",http://www.dailymail.co.uk/ushome/index.html,NULL,https://i.dailymail.co.uk/1s/2026/01/13/17/105479639-0-image-m-63_1768324774068.jpg,"2026-01-13 13:26:50",,https://www.dailymail.co.uk/news/article-15460401/Teens-fake-messages-paedophile-death-rocks-Isle-Sheppey.html?ns_mchannel=rss&ns_campaign=1490&ito=1490,"2026-01-13 16:51:12"
6046277,"QUENTIN LETTS: Not a single backbench MP backed the new spy base - sorry, I mean new embassy",https://www.dailymail.co.uk/news/article-15460791/QUENTIN-LETTS-backbench-MP-China-embassy-Keir-Starmer.html?ns_mchannel=rss&ns_campaign=1490&ito=1490,Editor,"Not a single backbencher supported the planned London spy base - sorry, I do apologise, I mean embassy. Even some of Labour's most assiduous greasers criticised the proposal.","The Daily Mail","2026-01-13 13:22:02",http://www.dailymail.co.uk/ushome/index.html,NULL,https://i.dailymail.co.uk/1s/2026/01/13/19/105483695-0-image-a-11_1768332770567.jpg,"2026-01-13 13:22:02",,https://www.dailymail.co.uk/news/article-15460791/QUENTIN-LETTS-backbench-MP-China-embassy-Keir-Starmer.html?ns_mchannel=rss&ns_campaign=1490&ito=1490,"2026-01-13 16:51:12"
6046278,"Donald Trump's estranged niece Mary, 60, announces she has married second wife",https://www.dailymail.co.uk/news/article-15460151/mary-trump-married-donald-niece.html?ns_mchannel=rss&ns_campaign=1490&ito=1490,Editor,"Mary Trump shared that she married her second wife in a private ceremony last October. She said: 'There is a human impulse during dark times to turn away from the light.'","The Daily Mail","2026-01-13 13:21:51",http://www.dailymail.co.uk/ushome/index.html,NULL,https://i.dailymail.co.uk/1s/2026/01/13/18/105479333-0-image-m-9_1768327230177.jpg,"2026-01-13 13:21:51",,https://www.dailymail.co.uk/news/article-15460151/mary-trump-married-donald-niece.html?ns_mchannel=rss&ns_campaign=1490&ito=1490,"2026-01-13 16:51:12"
6046279,"Porsche racing socialite, 69, at war with tycoon ex-husband says he has forced her to sue her billionaire best friends",https://www.dailymail.co.uk/news/article-15459629/colorado-socialite-renee-brinkerhoff-lawsuit-cargill.html?ns_mchannel=rss&ns_campaign=1490&ito=1490,Editor,"Renee Brinkerhoff claimed she was forced to sue the billionaire heirs to the Cargill agribusiness after her ex-husband allegedly siphoned $1.1 million from the company she acquired through their split.","The Daily Mail","2026-01-13 13:19:54",http://www.dailymail.co.uk/ushome/index.html,NULL,https://i.dailymail.co.uk/1s/2026/01/13/17/105479469-0-image-m-14_1768324584179.jpg,"2026-01-13 13:19:54",,https://www.dailymail.co.uk/news/article-15459629/colorado-socialite-renee-brinkerhoff-lawsuit-cargill.html?ns_mchannel=rss&ns_campaign=1490&ito=1490,"2026-01-13 16:51:12"
6046280,"Deserted narrowboats are still stuck in the mud of drained canal weeks after  dramatic embankment collapse",https://www.dailymail.co.uk/news/article-15460655/Deserted-narrowboats-stuck-mud-drained-canal-weeks-dramatic-embankment-collapse.html?ns_mchannel=rss&ns_campaign=1490&ito=1490,Editor,"Deserted narrowboats are still stuck in the mud of a drained canal weeks after a dramatic embankment collapse.","The Daily Mail","2026-01-13 13:19:08",http://www.dailymail.co.uk/ushome/index.html,NULL,https://i.dailymail.co.uk/1s/2026/01/13/19/105481967-0-image-m-17_1768332061983.jpg,"2026-01-13 13:19:08",,https://www.dailymail.co.uk/news/article-15460655/Deserted-narrowboats-stuck-mud-drained-canal-weeks-dramatic-embankment-collapse.html?ns_mchannel=rss&ns_campaign=1490&ito=1490,"2026-01-13 16:51:12"
6046281,"Minneapolis ICE agents detain seriously ill Libyan asylum seeker with agonizingly painful skin condition",https://www.dailymail.co.uk/news/article-15459641/Minneapolis-ICE-agents-detain-Libyan-asylum-seeker-skin-condition.html?ns_mchannel=rss&ns_campaign=1490&ito=1490,Editor,"A migrant with a rare genetic skin disorder was detained by ICE despite being an IT specialist with no criminal record and patiently awaiting a decision on his asylum case.","The Daily Mail","2026-01-13 13:18:41",http://www.dailymail.co.uk/ushome/index.html,NULL,https://i.dailymail.co.uk/1s/2026/01/13/18/105480283-0-image-m-54_1768328221267.jpg,"2026-01-13 13:18:41",,https://www.dailymail.co.uk/news/article-15459641/Minneapolis-ICE-agents-detain-Libyan-asylum-seeker-skin-condition.html?ns_mchannel=rss&ns_campaign=1490&ito=1490,"2026-01-13 16:51:12"
6046282,"Albanian illegal migrant will be deported for a FIFTH time after being found hiding in the back of trailer",https://www.dailymail.co.uk/news/article-15460265/Albanian-illegal-migrant-deported-FIFTH-time-hiding-trailer.html?ns_mchannel=rss&ns_campaign=1490&ito=1490,Editor,"Since 2017 Romeo Zani (pictured) has repeatedly tried to enter the UK. He first came to the attention of the Border Force when he confessed he had entered the UK in the 'back of a lorry'.","The Daily Mail","2026-01-13 13:15:33",http://www.dailymail.co.uk/ushome/index.html,NULL,https://i.dailymail.co.uk/1s/2026/01/13/19/105482775-0-image-a-6_1768331634001.jpg,"2026-01-13 13:15:33",,https://www.dailymail.co.uk/news/article-15460265/Albanian-illegal-migrant-deported-FIFTH-time-hiding-trailer.html?ns_mchannel=rss&ns_campaign=1490&ito=1490,"2026-01-13 16:51:12"
6046283,"Mom warned her son was in danger. Then he walked into the woods and never came back... now, court records raise troubling questions",https://www.dailymail.co.uk/news/crime-desk/article-15456309/alabama-johnathan-boley-jameson-explosives-red-flags.html?ns_mchannel=rss&ns_campaign=1490&ito=1490,Editor,"Court records reveal that Jameson Kyle Boley's ex-wife Angel Boley warned that she and the couple's two young sons Johnathan and James could be in danger.","The Daily Mail","2026-01-13 12:48:36",http://www.dailymail.co.uk/ushome/index.html,NULL,https://i.dailymail.co.uk/1s/2026/01/12/17/105194677-0-image-m-24_1768240576752.jpg,"2026-01-13 12:48:36",,https://www.dailymail.co.uk/news/crime-desk/article-15456309/alabama-johnathan-boley-jameson-explosives-red-flags.html?ns_mchannel=rss&ns_campaign=1490&ito=1490,"2026-01-13 16:51:12"
6046284,"China's super-embassy 'could spy on the whole of Europe': London complex will become a Beijing intelligence hub, expert warns as plans reveal secret chamber next to sensitive City cables",https://www.dailymail.co.uk/news/article-15459329/Chinas-super-embassy-spy-Europe-London-complex-Beijing-intelligence-hub-expert-warns-plans-reveal-secret-chamber-sensitive-City-cables.html?ns_mchannel=rss&ns_campaign=1490&ito=1490,Editor,"Professor Anthony Glees, a professor of intelligence and security at University of Buckingham, said it would be 'absolutely mad' to allow China to go ahead with the development.","The Daily Mail","2026-01-13 12:36:57",http://www.dailymail.co.uk/ushome/index.html,NULL,https://i.dailymail.co.uk/1s/2026/01/13/12/105471695-0-image-m-42_1768308763950.jpg,"2026-01-13 12:36:57",,https://www.dailymail.co.uk/news/article-15459329/Chinas-super-embassy-spy-Europe-London-complex-Beijing-intelligence-hub-expert-warns-plans-reveal-secret-chamber-sensitive-City-cables.html?ns_mchannel=rss&ns_campaign=1490&ito=1490,"2026-01-13 16:51:12"
6046285,"Outlander star Sam Heughan set to lead Tartan Week parade in New York",https://www.dailymail.co.uk/news/article-15460235/Outlander-star-Sam-Heughan-set-lead-Tartan-Week-parade-New-York.html?ns_mchannel=rss&ns_campaign=1490&ito=1490,Editor,"Outlander star Sam Heughan is to lead the Tartan Day parade through the heart of New York Cityfor the second time.","The Daily Mail","2026-01-13 12:27:40",http://www.dailymail.co.uk/ushome/index.html,NULL,https://i.dailymail.co.uk/1s/2026/01/13/16/105479245-0-image-a-8_1768323591709.jpg,"2026-01-13 12:27:40",,https://www.dailymail.co.uk/news/article-15460235/Outlander-star-Sam-Heughan-set-lead-Tartan-Week-parade-New-York.html?ns_mchannel=rss&ns_campaign=1490&ito=1490,"2026-01-13 16:51:12"
6046286,"Headmaster at £36,000-a-year private school 'misused work credit cards for Lords tickets and luxury accommodation'",https://www.dailymail.co.uk/news/article-15460279/Headmaster-private-school-misused-work-credit-cards-Lords-tickets-luxury-accommodation.html?ns_mchannel=rss&ns_campaign=1490&ito=1490,Editor,"Julian Johnson-Munday appeared in the Westminster Magistrates' Court on Tuesday after he was charged with one count of fraud by false representation.","The Daily Mail","2026-01-13 12:17:49",http://www.dailymail.co.uk/ushome/index.html,NULL,https://i.dailymail.co.uk/1s/2026/01/13/18/73231979-0-image-m-8_1768329393325.jpg,"2026-01-13 12:17:49",,https://www.dailymail.co.uk/news/article-15460279/Headmaster-private-school-misused-work-credit-cards-Lords-tickets-luxury-accommodation.html?ns_mchannel=rss&ns_campaign=1490&ito=1490,"2026-01-13 16:51:12"
6046287,"Why I FORGIVE the woman who drowned our five children: Andrea Yates's ex-husband reveals he still calls murderer mom in astonishing interview about their relationship",https://www.dailymail.co.uk/news/article-15459561/Forgive-Andrea-Yates-drowned-bath-Rusty.html?ns_mchannel=rss&ns_campaign=1490&ito=1490,Editor,"In an exclusive interview with the Daily Mail, Rusty Yates said he still believes the real driving force behind his children's murders was ex-wife Andrea Yates's postpartum psychosis.","The Daily Mail","2026-01-13 12:08:48",http://www.dailymail.co.uk/ushome/index.html,NULL,https://i.dailymail.co.uk/1s/2026/01/13/15/105475679-0-image-a-56_1768318372999.jpg,"2026-01-13 12:08:48",,https://www.dailymail.co.uk/news/article-15459561/Forgive-Andrea-Yates-drowned-bath-Rusty.html?ns_mchannel=rss&ns_campaign=1490&ito=1490,"2026-01-13 16:51:12"
6046288,"School workers who forced Jewish MP to cancel academy visit also no-platformed Israeli tech firm as part of pro-Palestine campaign",https://www.dailymail.co.uk/news/article-15460273/School-workers-Jewish-MP-cancel-visit-no-platformed-Israeli-tech-firm.html?ns_mchannel=rss&ns_campaign=1490&ito=1490,Editor,"Damien Egan, the Labour MP for Bristol North East, was due to speak at Bristol Brunel Academy in his constituency back in September.","The Daily Mail","2026-01-13 12:05:21",http://www.dailymail.co.uk/ushome/index.html,NULL,https://i.dailymail.co.uk/1s/2026/01/13/18/105440885-0-image-m-11_1768330448379.jpg,"2026-01-13 12:05:21",,https://www.dailymail.co.uk/news/article-15460273/School-workers-Jewish-MP-cancel-visit-no-platformed-Israeli-tech-firm.html?ns_mchannel=rss&ns_campaign=1490&ito=1490,"2026-01-13 16:51:12"
